{
  "$schema": "http://json-schema.org/draft-07/schema#",
  "$id": "template.schema.json",
  "title": "Template Manifest",
  "description": "Top-level manifest for a deck template under templates/layouts/<name>/. Lists the layouts the template provides and references its theme. Layout internals live in templates/layouts/<name>/layouts/<layout>.json.",
  "type": "object",
  "required": ["name", "version", "theme_ref", "layouts"],
  "additionalProperties": false,
  "properties": {
    "name": {
      "type": "string",
      "minLength": 1,
      "pattern": "^[a-z][a-z0-9_]*$",
      "description": "Lowercase snake_case identifier. Must match the containing directory name."
    },
    "version": {
      "type": "string",
      "minLength": 1,
      "pattern": "^[0-9]+\\.[0-9]+\\.[0-9]+$",
      "description": "Semantic version of the template."
    },
    "status": {
      "type": "string",
      "enum": ["scaffold", "draft", "stable"]
    },
    "description": {
      "type": "string"
    },
    "theme_ref": {
      "type": "string",
      "minLength": 1,
      "pattern": "^[A-Za-z0-9_./-]+$",
      "description": "Workspace-relative path to the theme file. Must not contain '..' or start with '/'."
    },
    "layouts": {
      "type": "array",
      "minItems": 1,
      "items": {
        "type": "string",
        "minLength": 1,
        "pattern": "^[a-z][a-z0-9_]*$",
        "description": "Layout identifier. Must match a file at layouts/<id>.json under this template."
      }
    },
    "todo": {
      "type": "array",
      "items": { "type": "string" }
    }
  }
}
